[
  {
    "id": 3,
    "slug": "3",
    "Unique ID": 3,
    "Workshop": [
      {
        "slug": "rapid-ideation-workshop-template",
        "label": "Rapid Ideation Workshop Template"
      }
    ],
    "Order": "1",
    "Section / Prompt": "So What",
    "What Goes Here": "A short paragraph on why this work came about and why it is prioritized now, so everyone understands the stakes."
  },
  {
    "id": 4,
    "slug": "4",
    "Unique ID": 4,
    "Workshop": [
      {
        "slug": "rapid-ideation-workshop-template",
        "label": "Rapid Ideation Workshop Template"
      }
    ],
    "Order": "2",
    "Section / Prompt": "Problems You Assume (per audience)",
    "What Goes Here": "Every problem the team assumes about the current state, listed for each audience."
  },
  {
    "id": 5,
    "slug": "5",
    "Unique ID": 5,
    "Workshop": [
      {
        "slug": "rapid-ideation-workshop-template",
        "label": "Rapid Ideation Workshop Template"
      }
    ],
    "Order": "3",
    "Section / Prompt": "How Might We Transformation Table",
    "What Goes Here": "Columns: person who took the row, the original research result or assumed problem, and the resulting HMW statement (\"How might we solve the problem and serve the need?\")."
  },
  {
    "id": 6,
    "slug": "6",
    "Unique ID": 6,
    "Workshop": [
      {
        "slug": "rapid-ideation-workshop-template",
        "label": "Rapid Ideation Workshop Template"
      }
    ],
    "Order": "4",
    "Section / Prompt": "Prioritization Matrix (Risk and Certainty)",
    "What Goes Here": "A MoSCoW matrix: place each HMW by risk and certainty. Top = high risk, low certainty; High = high risk, high certainty; Medium = low risk, low certainty; Low = low risk, high certainty."
  },
  {
    "id": 7,
    "slug": "7",
    "Unique ID": 7,
    "Workshop": [
      {
        "slug": "rapid-ideation-workshop-template",
        "label": "Rapid Ideation Workshop Template"
      }
    ],
    "Order": "5",
    "Section / Prompt": "Crazy 8's, Round 1",
    "What Goes Here": "Eight boxes. Sketch eight ideas in eight minutes for your chosen HMW, one minute per idea."
  },
  {
    "id": 8,
    "slug": "8",
    "Unique ID": 8,
    "Workshop": [
      {
        "slug": "rapid-ideation-workshop-template",
        "label": "Rapid Ideation Workshop Template"
      }
    ],
    "Order": "6",
    "Section / Prompt": "Crazy 8's, Round 2",
    "What Goes Here": "Eight boxes. Sketch eight new ideas built on your starred favorite three, again eight minutes."
  },
  {
    "id": 9,
    "slug": "9",
    "Unique ID": 9,
    "Workshop": [
      {
        "slug": "empathy-map-workshop-template",
        "label": "Empathy Map Workshop Template"
      }
    ],
    "Order": "1",
    "Section / Prompt": "I THINK",
    "What Goes Here": "What is going on in the user's mind: their thoughts, beliefs, and preoccupations about the situation."
  },
  {
    "id": 10,
    "slug": "10",
    "Unique ID": 10,
    "Workshop": [
      {
        "slug": "empathy-map-workshop-template",
        "label": "Empathy Map Workshop Template"
      }
    ],
    "Order": "2",
    "Section / Prompt": "I ACT",
    "What Goes Here": "What the user actually does: their observable behaviors and actions."
  },
  {
    "id": 11,
    "slug": "11",
    "Unique ID": 11,
    "Workshop": [
      {
        "slug": "empathy-map-workshop-template",
        "label": "Empathy Map Workshop Template"
      }
    ],
    "Order": "3",
    "Section / Prompt": "I'M MOTIVATED BY",
    "What Goes Here": "What drives this user: their goals and motivations."
  },
  {
    "id": 12,
    "slug": "12",
    "Unique ID": 12,
    "Workshop": [
      {
        "slug": "empathy-map-workshop-template",
        "label": "Empathy Map Workshop Template"
      }
    ],
    "Order": "4",
    "Section / Prompt": "I FEEL",
    "What Goes Here": "The user's emotional state: worries, frustrations, and hopes."
  },
  {
    "id": 13,
    "slug": "13",
    "Unique ID": 13,
    "Workshop": [
      {
        "slug": "empathy-map-workshop-template",
        "label": "Empathy Map Workshop Template"
      }
    ],
    "Order": "5",
    "Section / Prompt": "I SAY",
    "What Goes Here": "What the user says out loud about the situation; representative quotes."
  },
  {
    "id": 14,
    "slug": "14",
    "Unique ID": 14,
    "Workshop": [
      {
        "slug": "empathy-map-workshop-template",
        "label": "Empathy Map Workshop Template"
      }
    ],
    "Order": "6",
    "Section / Prompt": "I VALUE",
    "What Goes Here": "What matters most to this user: their principles and priorities."
  },
  {
    "id": 15,
    "slug": "15",
    "Unique ID": 15,
    "Workshop": [
      {
        "slug": "market-research-and-competitive-analysis-workshop-template",
        "label": "Market Research and Competitive Analysis Workshop Template"
      }
    ],
    "Order": "1",
    "Section / Prompt": "Problems to Solve",
    "What Goes Here": "The business and user problems that create the opportunity for this analysis."
  },
  {
    "id": 16,
    "slug": "16",
    "Unique ID": 16,
    "Workshop": [
      {
        "slug": "market-research-and-competitive-analysis-workshop-template",
        "label": "Market Research and Competitive Analysis Workshop Template"
      }
    ],
    "Order": "2",
    "Section / Prompt": "Outcomes of the Analysis",
    "What Goes Here": "What the team hopes to gain from running the analysis."
  },
  {
    "id": 17,
    "slug": "17",
    "Unique ID": 17,
    "Workshop": [
      {
        "slug": "market-research-and-competitive-analysis-workshop-template",
        "label": "Market Research and Competitive Analysis Workshop Template"
      }
    ],
    "Order": "3",
    "Section / Prompt": "Scope Selection",
    "What Goes Here": "Check which of the five analyses to run this round: market research, competitor analysis, feature comparison, design pattern analysis, product positioning."
  },
  {
    "id": 18,
    "slug": "18",
    "Unique ID": 18,
    "Workshop": [
      {
        "slug": "market-research-and-competitive-analysis-workshop-template",
        "label": "Market Research and Competitive Analysis Workshop Template"
      }
    ],
    "Order": "4",
    "Section / Prompt": "Market Size Table",
    "What Goes Here": "Columns: Market, Channels/Segments, Today's Market Size, Top Companies in the Segment, Projected Growth. Fill from cited online research."
  },
  {
    "id": 19,
    "slug": "19",
    "Unique ID": 19,
    "Workshop": [
      {
        "slug": "market-research-and-competitive-analysis-workshop-template",
        "label": "Market Research and Competitive Analysis Workshop Template"
      }
    ],
    "Order": "5",
    "Section / Prompt": "Market Opportunity",
    "What Goes Here": "Which market segment has the largest opportunity, and why."
  },
  {
    "id": 20,
    "slug": "20",
    "Unique ID": 20,
    "Workshop": [
      {
        "slug": "market-research-and-competitive-analysis-workshop-template",
        "label": "Market Research and Competitive Analysis Workshop Template"
      }
    ],
    "Order": "6",
    "Section / Prompt": "Audience Segmentation",
    "What Goes Here": "Your target audience broken into geographic, behavioral, demographic, and socioeconomic segments."
  },
  {
    "id": 21,
    "slug": "21",
    "Unique ID": 21,
    "Workshop": [
      {
        "slug": "market-research-and-competitive-analysis-workshop-template",
        "label": "Market Research and Competitive Analysis Workshop Template"
      }
    ],
    "Order": "7",
    "Section / Prompt": "Competitor Questions",
    "What Goes Here": "The questions you want answered about direct and indirect competitors, unique to your project."
  },
  {
    "id": 22,
    "slug": "22",
    "Unique ID": 22,
    "Workshop": [
      {
        "slug": "market-research-and-competitive-analysis-workshop-template",
        "label": "Market Research and Competitive Analysis Workshop Template"
      }
    ],
    "Order": "8",
    "Section / Prompt": "Direct and Indirect Competitor Analysis Table",
    "What Goes Here": "Per competitor: direct or indirect, market segment, website, main features, how they differentiate, what they do well and poorly, plus your project-specific questions."
  },
  {
    "id": 23,
    "slug": "23",
    "Unique ID": 23,
    "Workshop": [
      {
        "slug": "market-research-and-competitive-analysis-workshop-template",
        "label": "Market Research and Competitive Analysis Workshop Template"
      }
    ],
    "Order": "9",
    "Section / Prompt": "Feature Comparison Chart",
    "What Goes Here": "Your product versus competitors across each feature (present or absent), to reveal what is common, unique, and missing."
  },
  {
    "id": 24,
    "slug": "24",
    "Unique ID": 24,
    "Workshop": [
      {
        "slug": "market-research-and-competitive-analysis-workshop-template",
        "label": "Market Research and Competitive Analysis Workshop Template"
      }
    ],
    "Order": "10",
    "Section / Prompt": "Design Pattern Analysis Table",
    "What Goes Here": "Per competitor: website, key design patterns, what makes them effective or ineffective, and how you will apply them."
  },
  {
    "id": 25,
    "slug": "25",
    "Unique ID": 25,
    "Workshop": [
      {
        "slug": "market-research-and-competitive-analysis-workshop-template",
        "label": "Market Research and Competitive Analysis Workshop Template"
      }
    ],
    "Order": "11",
    "Section / Prompt": "Unique Value Summary",
    "What Goes Here": "What competitors do not do well, and what your business can do differently."
  },
  {
    "id": 26,
    "slug": "26",
    "Unique ID": 26,
    "Workshop": [
      {
        "slug": "market-research-and-competitive-analysis-workshop-template",
        "label": "Market Research and Competitive Analysis Workshop Template"
      }
    ],
    "Order": "12",
    "Section / Prompt": "Product Positioning Statement",